,Diagnosis,Justification
0,Polycystic Ovary Syndrome (PCOS),"PCOS is a common cause of irregular menstrual cycles in women of reproductive age. It is often associated with stress and lifestyle changes, and can present with symptoms such as irregular periods, which Emily is experiencing."
1,Thyroid Dysfunction,"Thyroid disorders, such as hypothyroidism or hyperthyroidism, can lead to menstrual irregularities. Although Emily has no significant weight changes or other symptoms, thyroid function tests are often considered in such cases."
2,Hyperprolactinemia,"Elevated prolactin levels can cause irregular menstrual cycles. This condition can be related to stress, which Emily has reported, and should be considered as a potential cause."
3,Premature Ovarian Insufficiency,"Although less common, premature ovarian insufficiency can cause irregular menstrual cycles in women under 40. It is important to consider this diagnosis, especially if other causes are ruled out."
4,Functional Hypothalamic Amenorrhea,"This condition is often related to stress, weight loss, or excessive exercise. While Emily has not reported significant weight changes or excessive exercise, her increased stress levels could contribute to this condition."
5,Uterine Fibroids,"Fibroids can cause changes in menstrual flow and irregular cycles. Although Emily has not reported significant pain, fibroids can sometimes be asymptomatic or cause mild symptoms."
