,Diagnosis,Justification
0,Plantar Fasciitis,"The patient presents with heel pain that worsens with walking or standing on tiptoes, and has a history of increased running activity, which are classic signs of plantar fasciitis."
1,Achilles Tendinitis,"The sharp pain in the heel, especially after increased physical activity, could indicate inflammation of the Achilles tendon, common in runners."
2,Calcaneal Stress Fracture,"The recent increase in running and the sharp pain in the heel could suggest a stress fracture in the calcaneus, especially if the pain is persistent and worsens with weight-bearing activities."
3,Retrocalcaneal Bursitis,The location of the pain and the recent increase in physical activity could also suggest inflammation of the bursa located near the heel.
4,Heel Pad Syndrome,"Although less common, the pain could be due to thinning of the heel pad, especially if the patient has been engaging in high-impact activities like running."
