,Diagnosis,Justification
0,Chronic Obstructive Pulmonary Disease (COPD),"The patient has a history of smoking for 20 years and presents with a chronic cough, occasional sputum production, and shortness of breath, which are common symptoms of COPD. Additionally, her father had COPD, suggesting a possible genetic predisposition."
1,Chronic Bronchitis,"The chronic cough with occasional sputum production and history of smoking are indicative of chronic bronchitis, a type of COPD."
2,Asthma,"Although the patient denies wheezing, the presence of a chronic cough, occasional shortness of breath, and a history of smoking cessation could suggest asthma, especially if there is an element of airway hyperreactivity."
3,Post-nasal Drip Syndrome,"The frequent throat clearing and dry cough could be due to post-nasal drip, which is a common cause of chronic cough."
4,Gastroesophageal Reflux Disease (GERD),"GERD can cause a chronic cough due to acid irritation of the throat, and the patient’s symptoms of throat clearing and cough could be related to this condition."
5,Lung Cancer,"Given the patient's smoking history and chronic cough, lung cancer should be considered, although the absence of weight loss and significant hemoptysis makes it less likely."
6,Interstitial Lung Disease,"The chronic cough and occasional shortness of breath could suggest interstitial lung disease, especially if there is a history of environmental exposures, although the patient denies known exposures."
7,Medication-induced Cough,"The patient is on medication for hypertension, and some antihypertensive drugs, like ACE inhibitors, can cause a chronic cough."
