,Diagnosis,Justification
0,Hypothyroidism,"The patient presents with fatigue, weight loss, and decreased appetite, which are common symptoms of hypothyroidism. Additionally, the patient reports feeling tired despite sleeping more, which can be associated with thyroid dysfunction."
1,Anemia,"The patient appears pale and reports fatigue and decreased appetite, which are classic symptoms of anemia. The lack of family history of anemia does not rule out the possibility of acquired anemia."
2,Depression,"The patient reports increased stress at work, fatigue, decreased appetite, and weight loss, which are common symptoms of depression. The lack of interest in exercise and persistent tiredness despite adequate sleep further support this possibility."
3,Chronic Fatigue Syndrome,"The persistent fatigue lasting over a month, despite adequate sleep, could suggest chronic fatigue syndrome, especially in the absence of other significant medical history."
4,Sleep Apnea,"Although the patient reports sleeping more, the quality of sleep may be poor, leading to persistent fatigue. Sleep apnea could be a consideration, especially if there are any unreported symptoms like snoring."
5,Iron Deficiency,"The patient's pale appearance and fatigue could be indicative of iron deficiency, which is a common cause of fatigue in women, especially if dietary intake has decreased."
6,Adrenal Insufficiency,"The symptoms of fatigue, weight loss, and decreased appetite could also be indicative of adrenal insufficiency, although less common, it should be considered."
