,Diagnosis,Justification
0,Cerebral contusion or concussion,"The patient experienced a fall with subsequent loss of consciousness and is now presenting with headache and confusion, which are common symptoms following a head injury."
1,Subdural hematoma,"Given the patient's age and the history of a fall with loss of consciousness, a subdural hematoma is a possibility, especially considering the confusion and headache."
2,Syncope due to orthostatic hypotension,"The patient experienced dizziness before the fall, which could suggest a syncopal episode possibly related to orthostatic hypotension, especially given his history of hypertension and medication use."
3,Transient ischemic attack (TIA),"Considering the patient's age, family history of stroke, and sudden onset of symptoms, a TIA could be a potential cause of the transient loss of consciousness and confusion."
4,Hypertensive crisis,"Although the blood pressure is not extremely high, the history of hypertension and the acute presentation of symptoms could suggest a hypertensive crisis leading to neurological symptoms."
5,Vestibular disorder,"The sudden dizziness and subsequent fall could be related to a vestibular disorder, which can cause balance issues and dizziness."
