,Investigations,Justification
0,Pelvic ultrasound,"To evaluate for gynecological causes of lower abdominal pain such as ovarian cysts, ectopic pregnancy, or other pelvic pathology."
1,Urine pregnancy test,"To rule out pregnancy, including ectopic pregnancy, as a cause of lower abdominal pain in a sexually active female."
2,Complete blood count (CBC),"To check for signs of infection or inflammation, such as elevated white blood cell count, which could indicate appendicitis or pelvic inflammatory disease."
3,Urinalysis,To rule out urinary tract infection or other urinary causes of abdominal pain.
4,"STI screening (e.g., chlamydia, gonorrhea)",To rule out sexually transmitted infections that could cause pelvic inflammatory disease and lower abdominal pain.
5,Serum electrolytes,To assess for any electrolyte imbalances that could be contributing to the patient's symptoms.
