,Investigations,Justification
0,Complete Blood Count (CBC),"To check for signs of infection or inflammation, which could be contributing to the fever and seizures."
1,Serum Electrolytes,"To rule out electrolyte imbalances, such as hyponatremia or hypocalcemia, which can cause seizures."
2,Blood Glucose Level,To rule out hypoglycemia as a cause of seizures.
3,Lumbar Puncture,"To rule out meningitis or encephalitis, especially given the fever and recent upper respiratory infection."
4,Electroencephalogram (EEG),To assess for any abnormal brain activity and help differentiate between different types of seizures.
5,Neuroimaging (CT or MRI),To rule out structural brain abnormalities or lesions that could be causing seizures.
6,Blood Culture,To identify any bacterial infection that could be causing the fever and seizures.
7,Urinalysis,"To check for urinary tract infection, which can sometimes present with fever and seizures in young children."
