,Investigations,Justification
0,Throat swab for rapid antigen detection test (RADT) for Group A Streptococcus,"To rule out or confirm streptococcal pharyngitis, which is a common cause of sore throat and requires antibiotic treatment."
1,Throat culture,"If the rapid antigen test is negative, a throat culture can be performed to confirm the presence of bacterial infection, especially if symptoms persist."
2,Complete blood count (CBC),"To check for signs of infection or inflammation, such as elevated white blood cell count, which can help differentiate between viral and bacterial causes."
3,Monospot test (heterophile antibody test),"To rule out infectious mononucleosis, especially given the fever and sore throat symptoms."
4,C-reactive protein (CRP),"To assess the level of inflammation in the body, which can help in determining the severity of the infection."
