,Investigations,Justification
0,HbA1c test,To assess long-term glucose control and determine if diabetes management needs adjustment.
1,Fasting blood glucose,To evaluate current blood sugar levels and identify any immediate concerns of hyperglycemia.
2,Lipid profile,"To assess cardiovascular risk factors, as the patient has a history of hypertension and diabetes."
3,Serum creatinine and eGFR,"To evaluate kidney function, as diabetes can lead to nephropathy."
4,Urine microalbumin,To detect early signs of diabetic nephropathy.
5,Electrolyte panel,To check for any electrolyte imbalances that could be contributing to fatigue.
6,Complete blood count (CBC),To rule out anemia or infection as a cause of fatigue.
7,Thyroid function tests,To rule out hypothyroidism as a cause of fatigue.
8,ECG,"To assess cardiac function, given the patient's history of hypertension and potential cardiovascular risk."
