,Investigations,Justification
0,Forensic examination,"To collect evidence related to the sexual assault, which may include swabs, hair samples, and clothing analysis."
1,Sexually Transmitted Infection (STI) screening,To check for any sexually transmitted infections that may have been contracted during the assault.
2,Pregnancy test,To rule out pregnancy resulting from the assault.
3,Complete blood count (CBC),To assess overall health and check for signs of infection or other medical issues.
4,HIV test,"To rule out HIV infection, which is a concern following sexual assault."
5,Hepatitis B and C screening,"To check for hepatitis infections, which can be transmitted sexually."
6,Urinalysis,To check for any urinary tract infections or other abnormalities.
7,Toxicology screen,To determine if any drugs were used to facilitate the assault.
