,Physical Exam,Justification
0,General appearance assessment,"To observe the patient's overall demeanor, level of distress, and any visible signs of illness or discomfort."
1,Vital signs measurement,To confirm the vitals provided and assess for any changes or abnormalities.
2,Oral examination,"To check for signs of dehydration, such as dry mucous membranes, which can be associated with increased thirst."
3,Skin examination,"To look for signs of dehydration or acanthosis nigricans, which can be associated with insulin resistance."
4,Abdominal examination,"To assess for any abdominal pain or organomegaly, which could be related to diabetes or other conditions."
5,Neurological examination,"To ensure there are no neurological deficits, as diabetes can sometimes present with neurological symptoms."
6,Weight and height measurement,To assess growth patterns and check for any discrepancies that might indicate underlying health issues.
7,Urinalysis,"To check for glucose or ketones in the urine, which can help in diagnosing diabetes."
